id,conversation_id,created_at,date,time,timezone,user_id,username,name,place,tweet,language,mentions,urls,photos,replies_count,retweets_count,likes_count,hashtags,cashtags,link,retweet,quote_url,video,thumbnail,near,geo,source,user_rt_id,user_rt,retweet_id,reply_to,retweet_date,translate,trans_src,trans_dest
1319551120151175168,1319551120151175168,2020-10-23 13:37:57 India Standard Time,2020-10-23,13:37:57,+0530,3186224294,e4mevents,e4m(Events),,Congratulating HT Media Ltd for winning the prestigious awards at the first edition of e4m's Red Carpet Experietial Marketing Awards 2020. #e4mRedCarpet  @htTweets @psomeshw @rajanbhalla11 @Samudrabtwitt @anuragbatrayo @nawalahuja @RenAameen @EverythingExp  https://t.co/brIZmUgUN0,en,"['httweets', 'psomeshw', 'rajanbhalla11', 'samudrabtwitt', 'anuragbatrayo', 'nawalahuja', 'renaameen', 'everythingexp']",[],['https://pbs.twimg.com/media/Ek_7nsYUUAACjGU.jpg'],0,0,2,['e4mredcarpet'],[],https://twitter.com/e4mevents/status/1319551120151175168,,,1,https://pbs.twimg.com/media/Ek_7nsYUUAACjGU.jpg,,,,,,,"{'user_id': None, 'username': None}",,,,
1316793643068424192,1316793643068424192,2020-10-15 23:00:44 India Standard Time,2020-10-15,23:00:44,+0530,1164692821447598080,fintechstats,fintech_stats,,Acquisition - Ht Media Ltd.  Link:  https://t.co/MXEvHTTnCZ Date: 15-Oct-2020,en,[],['https://www.bseindia.com/xml-data/corpfiling/AttachLive/4b9d6a42-3569-4c33-b515-22ce5571fedb.pdf'],[],0,0,0,[],[],https://twitter.com/FintechStats/status/1316793643068424192,,,0,,,,,,,,"{'user_id': None, 'username': None}",,,,
1316639364030496770,1316639364030496770,2020-10-15 12:47:41 India Standard Time,2020-10-15,12:47:41,+0530,2874766748,mma_4u,MMA Chennai,,"Pankaj Seith of HT Media Ltd shares insights on finding the right balance and winning in consumer business. Joining him in discussion are Mr C K Venkataraman of Titan &amp; Mr Rahul Varma of InfoLeap on Saturday, 17 Oct 2020 at 06:00 PM   https://t.co/irgqoBCcz0",en,[],['https://bit.ly/17_Oct_2020'],[],0,0,1,[],[],https://twitter.com/MMA_4u/status/1316639364030496770,,,0,,,,,,,,"{'user_id': None, 'username': None}",,,,
1315886117871259649,1315886117871259649,2020-10-13 10:54:33 India Standard Time,2020-10-13,10:54:33,+0530,2874766748,mma_4u,MMA Chennai,,Pankaj Seith of HT Media Ltd shares insights on finding the right balance and winning in consumer business. Joining him in discussion is C K Venkataraman of Titan Company Limited.   Watch the discussion #livestreaming on 17 Oct 2020 at 6 PM   https://t.co/npc6ADsrMy  https://t.co/HIgMgsBoCI,en,[],['https://liveibc.com/mmalive/'],['https://pbs.twimg.com/media/EkL3cQMVoAEsA3K.jpg'],0,0,0,['livestreaming'],[],https://twitter.com/MMA_4u/status/1315886117871259649,,,1,https://pbs.twimg.com/media/EkL3cQMVoAEsA3K.jpg,,,,,,,"{'user_id': None, 'username': None}",,,,
1312438837948248065,1312438837948248065,2020-10-03 22:36:17 India Standard Time,2020-10-03,22:36:17,+0530,125234330,teamlease,TeamLease Services,,"Prashant Khullar of Max Life Insurance, Sriram V of BankBazaar India, and Paras Kaushik of HT Media Ltd joins us in the 27th webinar under #PuttingIndiaBackToWork series.  Date: 6th October Time: 11:00 AM  Register now:  https://t.co/6AQfhJMm5l  @AmitVADERA  #Banking #discussion  https://t.co/MORPRV5fUT",en,['amitvadera'],['https://lnkd.in/eNtaq6T'],[],1,3,8,"['puttingindiabacktowork', 'banking', 'discussion']",[],https://twitter.com/TeamLease/status/1312438837948248065,,,1,https://pbs.twimg.com/ext_tw_video_thumb/1312438207615692802/pu/img/aV823AVQ82s7pBRC.jpg,,,,,,,"{'user_id': None, 'username': None}",,,,
1312004767426605056,1312004761521065984,2020-10-02 17:51:27 India Standard Time,2020-10-02,17:51:27,+0530,1232261076160401411,ieeemsit,IEEE MSIT,,"Prior to this, he has experience of working with XSEED Education, an Ed-Tech organization &amp; has had a long stint of managing and growing StudyMate brand at HT Media Ltd.",en,[],[],[],1,0,5,[],[],https://twitter.com/ieeemsit/status/1312004767426605056,,,0,,,,,,,,"{'user_id': '1232261076160401411', 'username': 'ieeemsit'}",,,,
1308008244703637510,1308008244703637510,2020-09-21 17:10:41 India Standard Time,2020-09-21,17:10:41,+0530,1159042033723379714,lawwiser,LawWiser,,"Watch the video below, by expert Govind Vijay, Deputy General Counsel, HT Media Ltd on the copyright issue of e-papers circulation.   https://t.co/Qhgy4anTWc  #Law #Lawyer #LawFirm #ENewspapers #Whatsapp #LawWiser #copyright #copyrightlaw #intellectualproperty #FakeNews",en,[],['https://lawwiser.com/one-on-one-the-copyright-issue-of-the-e-newspapers/'],[],0,0,0,"['law', 'lawyer', 'lawfirm', 'enewspapers', 'whatsapp', 'lawwiser', 'copyright', 'copyrightlaw', 'intellectualproperty', 'fakenews']",[],https://twitter.com/LawWiser/status/1308008244703637510,,,0,,,,,,,,"{'user_id': None, 'username': None}",,,,
1307814532186808320,1307814532186808320,2020-09-21 04:20:57 India Standard Time,2020-09-21,04:20:57,+0530,906021147015135232,pfdbot,PFD Bot,,"Alaskans own 48,829 shares of Ht Media Ltd, worth $31,718.58. It's in the Media &amp; Entertainment industry, based in 🇮🇳 India.",en,[],[],[],0,0,0,[],[],https://twitter.com/pfdbot/status/1307814532186808320,,,0,,,,,,,,"{'user_id': None, 'username': None}",,,,
1304372148899729409,1304372148899729409,2020-09-11 16:22:09 India Standard Time,2020-09-11,16:22:09,+0530,589779005,impact_onnet,Impact Magazine,,"Here's what Rajiv Beotra, Executive Director, and Rajan Bhalla, Group CMO, HT Media Ltd has to say on the insights behind the recent Hindustan Times overhaul.    https://t.co/QWa55jYuOR  #IMPACTMagazine #Interview #HindustanTimes  https://t.co/xlqDRSgAYS",en,[],['https://www.impactonnet.com/spotlight/inside-the-revamped-integrated-hindustan-times-7119.html'],['https://pbs.twimg.com/media/EhoNtr4VoAA0mBM.jpg'],0,0,2,"['impactmagazine', 'interview', 'hindustantimes']",[],https://twitter.com/IMPACT_onnet/status/1304372148899729409,,,1,https://pbs.twimg.com/media/EhoNtr4VoAA0mBM.jpg,,,,,,,"{'user_id': None, 'username': None}",,,,
1303602878989234176,1303602878989234176,2020-09-09 13:25:20 India Standard Time,2020-09-09,13:25:20,+0530,589779005,impact_onnet,Impact Magazine,,"Rajiv Beotra, Executive Director, and Rajan Bhalla, Group CMO, HT Media Ltd on the insights behind the recent Hindustan Times overhaul.  Read the interview by @deepeverest here:  https://t.co/QWa55jYuOR   @HindustanTimes #IMPACTMagazine #Interview #Spotlight",en,"['deepeverest', 'hindustantimes']",['https://www.impactonnet.com/spotlight/inside-the-revamped-integrated-hindustan-times-7119.html'],[],0,0,0,"['impactmagazine', 'interview', 'spotlight']",[],https://twitter.com/IMPACT_onnet/status/1303602878989234176,,,0,,,,,,,,"{'user_id': None, 'username': None}",,,,
1301105745497223168,1301105745497223168,2020-09-02 16:02:37 India Standard Time,2020-09-02,16:02:37,+0530,122324271,e4mtweets,exchange4media group,,"Media consumption and media buying patterns have changed drastically in the last 4 to 5 months of lockdown. With strong digital presence, we now have a renewed digital print offering with a collaborative approach across platforms. -Rajeev Beotra,HT Media Ltd @htTweets #e4mWebinar",en,['httweets'],[],[],0,0,0,['e4mwebinar'],[],https://twitter.com/e4mtweets/status/1301105745497223168,,,0,,,,,,,,"{'user_id': None, 'username': None}",,,,
1301102735484354562,1301102735484354562,2020-09-02 15:50:40 India Standard Time,2020-09-02,15:50:40,+0530,122324271,e4mtweets,exchange4media group,,"""The refreshed product fits the fast-paced, knowledge-seeking needs of the millennials without alienating the older generation who are also fast adapting to the new ways of news consumption.""- Rajan Bhalla, Group CMO, HT Media Ltd, @RajanBhalla4  @htTweets #e4mWebinar",en,"['rajanbhalla4', 'httweets']",[],[],0,0,0,['e4mwebinar'],[],https://twitter.com/e4mtweets/status/1301102735484354562,,,0,,,,,,,,"{'user_id': None, 'username': None}",,,,
1301098818004381697,1301098818004381697,2020-09-02 15:35:06 India Standard Time,2020-09-02,15:35:06,+0530,122324271,e4mtweets,exchange4media group,,"""HT launched 'first voice, last word'. first voice alludes to its digital-first approach and the 'last word' captures the essence of journalism associated with a credible, trusted and respected"" - Rajan Bhalla, Group CMO, HT Media Ltd, @RajanBhalla4  @htTweets #e4mWebinar",en,"['rajanbhalla4', 'httweets']",[],[],0,0,2,['e4mwebinar'],[],https://twitter.com/e4mtweets/status/1301098818004381697,,,0,,,,,,,,"{'user_id': None, 'username': None}",,,,
1301094775056023553,1301094775056023553,2020-09-02 15:19:02 India Standard Time,2020-09-02,15:19:02,+0530,122324271,e4mtweets,exchange4media group,,"""From the past month, It has been a sequential improvement and language has possibly seen a resilience overall compare to English.""- Rajeev Beotra, Executive Director-Revenue, HT Media Ltd  @htTweets #e4mWebinar",en,['httweets'],[],[],0,0,0,['e4mwebinar'],[],https://twitter.com/e4mtweets/status/1301094775056023553,,,0,,,,,,,,"{'user_id': None, 'username': None}",,,,
1301092569825198080,1301092569825198080,2020-09-02 15:10:16 India Standard Time,2020-09-02,15:10:16,+0530,122324271,e4mtweets,exchange4media group,,"""HT tried to break the myth, done a campaign to convince people that newspapers are not the carriers of viruses.""- Rajan Bhalla, Group CMO, HT Media Ltd, @RajanBhalla4  @htTweets #e4mWebinar",en,"['rajanbhalla4', 'httweets']",[],[],0,0,1,['e4mwebinar'],[],https://twitter.com/e4mtweets/status/1301092569825198080,,,0,,,,,,,,"{'user_id': None, 'username': None}",,,,
1301031785669648389,1300865017802227712,2020-09-02 11:08:44 India Standard Time,2020-09-02,11:08:44,+0530,484561060,anujkatiyar17,Anuj Katiyar,,@VaradChowgule @sandysidk @arnabofficial7 @ishkarnBHANDARI @Swamy39 @TimesNow @republic No bro This is Hindustan news paper which belongs to HT Media Ltd whereas India Tv is an independent news service..both are different And this news is confirmed by other media houses as well,en,"['varadchowgule', 'sandysidk', 'arnabofficial7', 'ishkarnbhandari', 'swamy39', 'timesnow', 'republic']",[],[],1,0,0,[],[],https://twitter.com/AnujKatiyar17/status/1301031785669648389,,,0,,,,,,,,"{'user_id': '1101964754174672897', 'username': 'VaradChowgule'}",,,,
1300123756384473088,1300123756384473088,2020-08-30 23:00:33 India Standard Time,2020-08-30,23:00:33,+0530,1164692821447598080,fintechstats,fintech_stats,,Annual report uploaded by Ht Media Ltd.  Link:  https://t.co/HUu3ojw9Vb Date: 30-Aug-2020. Size: 322 pages.,en,[],['https://www.bseindia.com/xml-data/corpfiling/AttachLive/807cdec5-dc09-40cf-afbe-9b13b704dc76.pdf'],[],0,0,0,[],[],https://twitter.com/FintechStats/status/1300123756384473088,,,0,,,,,,,,"{'user_id': None, 'username': None}",,,,
1298986295167868930,1295677122204192768,2020-08-27 19:40:41 India Standard Time,2020-08-27,19:40:41,+0530,1163842037117902848,balidan4,Malay,,"Dear Customer, we are glad that your complaint regarding HT subscription has been successfully resolved. Pls feel free to call on 01160004242 if the resolution is not satisfactory. HT Media Ltd. *(lying HTMedia)* Never Ever buy annually newspaper's subscription's",en,[],[],[],0,0,0,[],[],https://twitter.com/Balidan4/status/1298986295167868930,,,0,,,,,,,,"{'user_id': '1163842037117902848', 'username': 'Balidan4'}",,,,
1298674334303756288,1298674334303756288,2020-08-26 23:01:04 India Standard Time,2020-08-26,23:01:04,+0530,1164692821447598080,fintechstats,fintech_stats,,Acquisition - Ht Media Ltd.  Link:  https://t.co/MgjWvVBr0Y Date: 26-Aug-2020Industry/Sector: Publishing  P/E: -2.18  Market cap : ₹382.64 Crs.,en,[],['https://www.bseindia.com/xml-data/corpfiling/AttachLive/9975ebd3-8c8c-4aae-8433-a12b12331966.pdf'],[],0,0,0,[],[],https://twitter.com/FintechStats/status/1298674334303756288,,,0,,,,,,,,"{'user_id': None, 'username': None}",,,,
1295757641315221504,1295757641315221504,2020-08-18 21:51:10 India Standard Time,2020-08-18,21:51:10,+0530,761086917563682818,cavinkareindia,CavinKare,,Hello CavinKareans!   An exciting day begins with some exciting conversations . Tune into Fever 91.9FM at 9am tomorrow to listen to our CKR sharing his entrepreneurial journey with listeners of Chennai !   Don't forget to tune to  Fever FM (HT Media Ltd.)   #CavinKare #FeverFm  https://t.co/qv8BRK53zp,en,[],[],[],0,0,0,"['cavinkare', 'feverfm']",[],https://twitter.com/CavinKareIndia/status/1295757641315221504,,,1,https://pbs.twimg.com/ext_tw_video_thumb/1295757453884362754/pu/img/i5XSzucCcDyLThnJ.jpg,,,,,,,"{'user_id': None, 'username': None}",,,,
1293857602648993794,1293857602648993794,2020-08-13 16:01:05 India Standard Time,2020-08-13,16:01:05,+0530,1159042033723379714,lawwiser,LawWiser,,"Watch Sachin Kalra, Deputy General Counsel - HT Media Ltd giving light on the instances of Fake News.  #Law #Lawyers #Legal #Lawyer #LawWiser #fakenews #regulations #htmedia  https://t.co/S2D7DbnP8m",en,[],['https://www.youtube.com/watch?v=3uIyU4r2SVQ'],[],0,1,0,"['law', 'lawyers', 'legal', 'lawyer', 'lawwiser', 'fakenews', 'regulations', 'htmedia']",[],https://twitter.com/LawWiser/status/1293857602648993794,,,0,,,,,,,,"{'user_id': None, 'username': None}",,,,
1293464123917787136,1293464123917787136,2020-08-12 13:57:33 India Standard Time,2020-08-12,13:57:33,+0530,876061277549875200,allaboutmusicin,allaboutmusicin,,"#AAM2020SPEAKER  Welcome, Gaurav Sharma. CPO, Fever FM, Radio Nasha, Radio One (HT Media Ltd) A veteran media professional and influencer, Gaurav is presently the Chief Programming &amp; Digital Strategy Officer for Fever FM, Radio Nasha and Radio One.  Meet him at #AAM2020VIRTUAL  https://t.co/OplvRRHwZI",en,[],[],['https://pbs.twimg.com/media/EfNOoifU0AE7o-r.jpg'],0,1,4,"['aam2020speaker', 'aam2020virtual']",[],https://twitter.com/allaboutmusicin/status/1293464123917787136,,,1,https://pbs.twimg.com/media/EfNOoifU0AE7o-r.jpg,,,,,,,"{'user_id': None, 'username': None}",,,,
1293081975478198272,1293081975478198272,2020-08-11 12:39:01 India Standard Time,2020-08-11,12:39:01,+0530,1203884614239932416,htsmartcast,HT Smartcast,,"#webinar On #producing #podcasts | Register here-  https://t.co/jiHZSRX76b  From #scripting &amp; #voiceacting to #packaging we will cover all with @rayspicture, National Creative &amp; Content Head, HT Media Ltd, @souniyakhurana, CEO @WYNStudio &amp; @rahulnarvekar, host, Rahul Narvekar Show  https://t.co/MkvXVqTzLk",en,"['rayspicture', 'souniyakhurana', 'wynstudio', 'rahulnarvekar']",['https://lnkd.in/eGKcAfu'],['https://pbs.twimg.com/media/EfHyvViXYAATOa2.jpg'],0,2,2,"['webinar', 'producing', 'podcasts', 'scripting', 'voiceacting', 'packaging']",[],https://twitter.com/HTSmartcast/status/1293081975478198272,,,1,https://pbs.twimg.com/media/EfHyvViXYAATOa2.jpg,,,,,,,"{'user_id': None, 'username': None}",,,,
1292895237749137408,1292895237749137408,2020-08-11 00:17:00 India Standard Time,2020-08-11,00:17:00,+0530,1246493186576355329,sen_bratati,Bratati Sen,,"The students of the BBA department, JEMTEC are visited various industries like HT Media, Minda Corporation Ltd., NSIC, NSE, etc.  https://t.co/r5tk6SJdBd  https://t.co/xS4fGiyd6Y",en,[],['https://www.jimsgn.org/industrial-visit-details.asp?sid=9'],['https://pbs.twimg.com/media/EfFJWZZUMAAuuPG.png'],0,0,2,[],[],https://twitter.com/sen_bratati/status/1292895237749137408,,,1,https://pbs.twimg.com/media/EfFJWZZUMAAuuPG.png,,,,,,,"{'user_id': None, 'username': None}",,,,
1289046074594713601,1289046074594713601,2020-07-31 09:21:48 India Standard Time,2020-07-31,09:21:48,+0530,1281179009624051712,antrapreneur_lj,Antrapreneur: The Business Incubator,,"HT Media Ltd, which publishes Hindustan Times, Hindustan and Mint newspapers among other properties, its board has approved the acquisition of Mosaic Media Ventures Pvt. Ltd from News Corp. Mosaic Media operates digital media properties  https://t.co/2QqAr7gTU3  https://t.co/YxaXLkUIod",en,[],['http://VCCircle.com'],['https://pbs.twimg.com/media/EeObiRdUcAE3O6b.jpg'],1,0,0,[],[],https://twitter.com/Antrapreneur_lj/status/1289046074594713601,,,1,https://pbs.twimg.com/media/EeObiRdUcAE3O6b.jpg,,,,,,,"{'user_id': None, 'username': None}",,,,
1288528069070913538,1288528069070913538,2020-07-29 23:03:26 India Standard Time,2020-07-29,23:03:26,+0530,1164692821447598080,fintechstats,fintech_stats,,Acquisition - Ht Media Ltd.  Link:  https://t.co/yY31qFRfJc Date: 29-Jul-2020Industry/Sector: Publishing  P/E: -1.63  Market cap : ₹286.51 Crs.,en,[],['https://www.bseindia.com/xml-data/corpfiling/AttachLive/c45a86f9-3da4-4388-a2e0-4a5eeba2326c.pdf'],[],0,0,0,[],[],https://twitter.com/FintechStats/status/1288528069070913538,,,0,,,,,,,,"{'user_id': None, 'username': None}",,,,
1288428497304608770,1288428497304608770,2020-07-29 16:27:46 India Standard Time,2020-07-29,16:27:46,+0530,34589718,dsij,Dalal Street Journal,,HT Media Ltd to acquire Mosaic Media Ventures Private Ltd  https://t.co/0HNCg5oo5g  https://t.co/gsCtyY1Fsd,en,[],['https://www.dsij.in/DSIJArticleDetail/ArtMID/10163/ArticleID/14090/HT-Media-Ltd-to-acquire-Mosaic-Media-Ventures-Private-Ltd'],['https://pbs.twimg.com/media/EeFq4duUYAEp9EZ.jpg'],0,0,2,[],[],https://twitter.com/DSIJ/status/1288428497304608770,,,1,https://pbs.twimg.com/media/EeFq4duUYAEp9EZ.jpg,,,,,,,"{'user_id': None, 'username': None}",,,,
1288375690446823424,1288375690446823424,2020-07-29 12:57:56 India Standard Time,2020-07-29,12:57:56,+0530,594482860,shaw_arun,Arun Shaw,,HT Media Ltd to acquire 100% stake in VCCircle and TechCircle  https://t.co/g5Xoufw1AR @vsengupta,en,['vsengupta'],['http://www.equitybulls.com/admin/news2006/news_det.asp?id=270964'],[],0,1,0,[],[],https://twitter.com/Shaw_arun/status/1288375690446823424,,,0,,,,,,,,"{'user_id': None, 'username': None}",,,,
1288373843283722241,1288373843283722241,2020-07-29 12:50:35 India Standard Time,2020-07-29,12:50:35,+0530,55813277,tweetsanup,Anup Sharma B'Harry,,"The pandemic time sale: HT Media Ltd acquires 100% stake in @vccircle  and to invest upto Rs. 6 Crore post working capital adjustment, and revenue linked milestones payment upto Rs.1 Crore on deferred basis.   https://t.co/rRdxJEW443",en,['vccircle'],['http://www.equitybulls.com/admin/news2006/news_det.asp?id=270964'],[],1,1,1,[],[],https://twitter.com/TweetsAnup/status/1288373843283722241,,,0,,,,,,,,"{'user_id': None, 'username': None}",,,,
1288366056075980805,1288366056075980805,2020-07-29 12:19:39 India Standard Time,2020-07-29,12:19:39,+0530,251951656,equitybulls,EquityBulls.com,,HT Media Ltd to acquire 100% stake in VCCircle and TechCircle  #HTMedia #VCCircle #TechCircle #Mosaic #Acquisition @vccircle    https://t.co/r3BSIWIbNv  https://t.co/8WiGRR4Ual,en,['vccircle'],['https://www.equitybulls.com/admin/news2006/news_det.asp?id=270964'],['https://pbs.twimg.com/media/EeEyFZpU4AM4LA2.png'],0,2,2,"['htmedia', 'vccircle', 'techcircle', 'mosaic', 'acquisition']",[],https://twitter.com/equitybulls/status/1288366056075980805,,,1,https://pbs.twimg.com/media/EeEyFZpU4AM4LA2.png,,,,,,,"{'user_id': None, 'username': None}",,,,
1288044920381378561,1288044920381378561,2020-07-28 15:03:34 India Standard Time,2020-07-28,15:03:34,+0530,2936776459,sisbl_in,Shriram Insight,,#ResultOut - #Q1FY21 - #HT #Media #Ltd  HT Media reported #Q1 #loss at Rs. 54.53 crore against Rs. 148.07 crore #YoY  #Revenue at Rs. 166.35 crore against Rs. 540.21 crore YoY  #Full #Result :  https://t.co/WOI0TJMZVI  https://t.co/VSyLc2cXLs,en,[],['https://www.bseindia.com/xml-data/corpfiling/AttachLive/2319d44e-1082-485f-8cc7-740821f90b91.pdf'],['https://pbs.twimg.com/media/EeAOBTjUMAUJVD1.jpg'],0,0,0,"['resultout', 'q1fy21', 'ht', 'media', 'ltd', 'q1', 'loss', 'yoy', 'revenue', 'full', 'result']",[],https://twitter.com/sisbl_in/status/1288044920381378561,,,1,https://pbs.twimg.com/media/EeAOBTjUMAUJVD1.jpg,,,,,,,"{'user_id': None, 'username': None}",,,,
1287947532891377665,1287947532891377665,2020-07-28 08:36:35 India Standard Time,2020-07-28,08:36:35,+0530,275589758,ja3rathod,RATHOD JATIN,,12:00 PM DCM Shriram Ltd Dial: + 91 22 6280 1141  12:00 PM Schaeffler Ind Dial: +91 22 6280 1102  12:00 PM United Spirits Dial: +91 22 6280 1250  3:00 PM HT Media Webinar:  https://t.co/G86krrOQ0i,en,[],['https://zoom.us/webinar/register/WN_wUXwOmHdTPmYAT3_jYKq6w'],[],1,1,0,[],[],https://twitter.com/JA3RATHOD/status/1287947532891377665,,,0,,,,,,,,"{'user_id': None, 'username': None}",,,,
1287734502039654402,1287734502039654402,2020-07-27 18:30:04 India Standard Time,2020-07-27,18:30:04,+0530,281499650,rrjansaamna,Ravi Kumar Rathore,,"Press Council of India @PressCouncil_IN takes Suo-motu cognizance with regard to the retrenchment of journalists, photojournalists and desk editors of Hindustan Times by HT Media ltd. at their various Bureaus. @HindustanTimes @bhadasmedia @yashbhadas @jyotiyadaav @AShrikantTshas2  https://t.co/2bc3C3x3fd",en,"['presscouncil_in', 'hindustantimes', 'bhadasmedia', 'yashbhadas', 'jyotiyadaav', 'ashrikanttshas2']",[],['https://pbs.twimg.com/media/Ed7zdynWoAAT85G.png'],0,0,0,[],[],https://twitter.com/rrjansaamna/status/1287734502039654402,,,1,https://pbs.twimg.com/media/Ed7zdynWoAAT85G.png,,,,,,,"{'user_id': None, 'username': None}",,,,
1283982258047561728,1283982258047561728,2020-07-17 10:00:00 India Standard Time,2020-07-17,10:00:00,+0530,36327407,httweets,Hindustan Times,,"To cater to the Bengali audience, HT Media Ltd. is proud to announce its Bengali News Website – HT Bangla.  With @HT_Bangla, take your brand to these 4 Million Bengali audience, click here:  https://t.co/9zZOngqqql  https://t.co/hsxwYT59qu",en,['ht_bangla'],['http://bangla.hindustantimes.com/partner-with-us.html'],['https://pbs.twimg.com/media/EdC7XK9U8AIR50Y.jpg'],2,1,7,[],[],https://twitter.com/htTweets/status/1283982258047561728,,,1,https://pbs.twimg.com/media/EdC7XK9U8AIR50Y.jpg,,,,,,,"{'user_id': None, 'username': None}",,,,
1283807216466898945,1283807216466898945,2020-07-16 22:24:27 India Standard Time,2020-07-16,22:24:27,+0530,2793631693,ashupandit_,Ashu A Star,,The comeback is always stronger than the setback♥️ @ HT Media LTD.  https://t.co/3nMW3BBNBp,en,[],['https://www.instagram.com/p/CCtdyj0HVhH/?igshid=eb1qnkn1xozk'],[],0,0,0,[],[],https://twitter.com/AshuPandit_/status/1283807216466898945,,,0,,,,,,,,"{'user_id': None, 'username': None}",,,,
1280864939947757568,1280864939947757568,2020-07-08 19:32:53 India Standard Time,2020-07-08,19:32:53,+0530,906021147015135232,pfdbot,PFD Bot,,"Alaskans own 48,829 shares of Ht Media Ltd, worth $31,718.58. It's in the Media &amp; Entertainment industry, based in 🇮🇳 India.",en,[],[],[],0,0,0,[],[],https://twitter.com/pfdbot/status/1280864939947757568,,,0,,,,,,,,"{'user_id': None, 'username': None}",,,,
1278621205231271936,1278621205231271936,2020-07-02 14:57:05 India Standard Time,2020-07-02,14:57:05,+0530,917050901713604609,asianarb,Inst. for Asian Arb.,,"RT AsiaLawPortal "".LawWiser brings you a conversation with Sachin Kalra, Deputy General Counsel – HT Media Ltd, about Fake News and how it’s regulated  https://t.co/JB3jfCJyUb""",en,[],['https://asialawportal.com/2020/07/02/fake-news-has-been-a-matter-of-concern-since-ancient-times-but-now-its-important-to-discuss-how-its-regulated/'],[],0,0,0,[],[],https://twitter.com/AsianArb/status/1278621205231271936,,,0,,,,,,,,"{'user_id': None, 'username': None}",,,,
1278618423711404038,1278618423711404038,2020-07-02 14:46:02 India Standard Time,2020-07-02,14:46:02,+0530,1368115844,asialawportal,Asia Law Portal,,".@LawWiser brings you a conversation with Sachin Kalra, Deputy General Counsel – HT Media Ltd, about Fake News and how it’s regulated  https://t.co/oavJ8w7iph",en,['lawwiser'],['https://asialawportal.com/2020/07/02/fake-news-has-been-a-matter-of-concern-since-ancient-times-but-now-its-important-to-discuss-how-its-regulated/'],[],0,0,3,[],[],https://twitter.com/AsiaLawPortal/status/1278618423711404038,,,0,,,,,,,,"{'user_id': None, 'username': None}",,,,
1278590542402605057,1278590542402605057,2020-07-02 12:55:15 India Standard Time,2020-07-02,12:55:15,+0530,1159042033723379714,lawwiser,LawWiser,,"Fake News is the matter of concern since the ancient times, but now it is important to discuss how it is regulated. LawWiser brings you a #Conversation with Sachin Kalra, Deputy General Counsel - HT Media Ltd.  @htTweets @AsiaLawPortal   https://t.co/SYPHeIjfsc",en,"['httweets', 'asialawportal']",['https://youtu.be/frx9YdiWhSo'],[],0,1,0,['conversation'],[],https://twitter.com/LawWiser/status/1278590542402605057,,,0,,,,,,,,"{'user_id': None, 'username': None}",,,,
1277603751889498113,1277603751889498113,2020-06-29 19:34:05 India Standard Time,2020-06-29,19:34:05,+0530,1487297204,abhinavpathak27,Abhinav Pathak,,"Catch me live with @rameshmenon66, CBO-Digital Innovation and New Businesses, HT Media Ltd; Ex-CEO @fg_buzz &amp; @airtelindia on our next episode of Rethink Retail this Saturday, 4th July!  Register here:  https://t.co/XONY5iaWmo  https://t.co/U9mWKeezDa",en,"['rameshmenon66', 'fg_buzz', 'airtelindia']",['http://perpule.com/rethinkretail'],['https://pbs.twimg.com/media/Ebr1t7iUwAA6nac.jpg'],1,1,1,[],[],https://twitter.com/abhinavpathak27/status/1277603751889498113,,,1,https://pbs.twimg.com/media/Ebr1t7iUwAA6nac.jpg,,,,,,,"{'user_id': None, 'username': None}",,,,
1277092773368217600,1277092773368217600,2020-06-28 09:43:39 India Standard Time,2020-06-28,09:43:39,+0530,1190814220562173952,dhananjaybarsa3,Dhananjay Barsagade🚀🐸,,Vineet Jain - Times Group Aroon Purie - India Today Group  Subhash Chandra - Zee Networks Mukesh Ambani - Network 18 Prafulla Kumar Sarkar - ABP Group Shobhana Bhartiya - HT Media Ramnath Goenka - Indian Express Ltd.  All of them famous for supporting barbarians.,en,[],[],[],0,0,0,[],[],https://twitter.com/DhananjayBarsa3/status/1277092773368217600,,,0,,,,,,,,"{'user_id': None, 'username': None}",,,,
